{
  "schema_version": "study-review-receipt-v1",
  "generation": 1,
  "predecessor_digest_sha256": null,
  "note": {
    "area": "papers",
    "slug": "prefix-tuning-2021",
    "digest_sha256": "7a79e09d4d75a26bbd5ba80ee281206d64f9c05d13049a5097022a2fac458fe8"
  },
  "source_revision": "arXiv:2101.00190v1",
  "research_input_sha256": "5e1f594b5843377dc37b38b9203e2d1b735e1b43029c2176aff65db9047501ff",
  "reviewers": [
    {
      "role": "ZERO_BASE",
      "reviewer_version": "study-static-review-20260714-40-paper-batch",
      "decision": "PASS_WITH_NOTES",
      "score": 84,
      "warnings": [
        "Zero-base explanation includes an analogy and toy mechanism check; paper benchmark was not executed."
      ],
      "execution": {
        "review_mode": "STATIC_REVIEW",
        "code_mode": "MANUAL_SIMULATION"
      }
    },
    {
      "role": "ENGINEER",
      "reviewer_version": "study-static-review-20260714-40-paper-batch",
      "decision": "PASS_WITH_NOTES",
      "score": 83,
      "warnings": [
        "Claims are limited to arXiv metadata and static paper reading; no repository or service integration was run."
      ],
      "execution": {
        "review_mode": "STATIC_REVIEW",
        "code_mode": "NOT_APPLICABLE"
      }
    },
    {
      "role": "ACADEMIC",
      "reviewer_version": "study-static-review-20260714-40-paper-batch",
      "decision": "PASS_WITH_NOTES",
      "score": 82,
      "warnings": [
        "Citation identity was checked through arXiv metadata; reported experimental numbers are not independently reproduced."
      ],
      "execution": {
        "review_mode": "STATIC_REVIEW",
        "code_mode": "NOT_APPLICABLE"
      }
    }
  ],
  "waivers": [],
  "created_at": "2026-07-14T12:00:00.000Z"
}
