{
  "schema_version": "study-review-receipt-v1",
  "generation": 1,
  "predecessor_digest_sha256": null,
  "note": {
    "area": "projects",
    "slug": "agenda",
    "digest_sha256": "209396c37567db30ac60e6763dd7dc099aa830207a73e60ad2df9aa64dc8cc6f"
  },
  "source_revision": "fd90c624938524f1a8f6793942d40f612acbff64",
  "research_input_sha256": "520ea265b0a7a2f1642048038f9f3b95d3dccf6b1949256740a686dd69283030",
  "reviewers": [
    {
      "role": "ZERO_BASE",
      "reviewer_version": "research-benchmark-static-20260827-il",
      "decision": "PASS_WITH_NOTES",
      "score": 92,
      "warnings": [
        "Separates v6 backend constructor, lock-versus-running stop contract, and numeric/cron/human-interval nextRunAt."
      ],
      "execution": {
        "review_mode": "STATIC_REVIEW",
        "code_mode": "NOT_APPLICABLE"
      }
    },
    {
      "role": "ENGINEER",
      "reviewer_version": "research-benchmark-static-20260827-il",
      "decision": "PASS_WITH_NOTES",
      "score": 93,
      "warnings": [
        "Agenda constructor, JobProcessor lock/stop, nextRunAt, and MongoBackend polling were inspected; no database was started."
      ],
      "execution": {
        "review_mode": "STATIC_REVIEW",
        "code_mode": "NOT_APPLICABLE"
      }
    },
    {
      "role": "ACADEMIC",
      "reviewer_version": "research-benchmark-static-20260827-il",
      "decision": "PASS_WITH_NOTES",
      "score": 91,
      "warnings": [
        "Binds reachable agenda@6.2.6 tag because npm gitHead is missing; later main commits were not used."
      ],
      "execution": {
        "review_mode": "STATIC_REVIEW",
        "code_mode": "NOT_APPLICABLE"
      }
    }
  ],
  "waivers": [],
  "created_at": "2026-08-27T11:10:00.000Z"
}
