{
  "schema_version": "study-review-receipt-v1",
  "generation": 1,
  "predecessor_digest_sha256": null,
  "note": {
    "area": "projects",
    "slug": "styled-components",
    "digest_sha256": "e1f1ae30a0e3d23d38f13d54e336ecb17d4f80b8162ffaa588cb96415c727207"
  },
  "source_revision": "159302389c696a7952aaed31d840b06b8aa6d677",
  "research_input_sha256": "7ea22a54be02c7c5d0de4b9e47a39348401a23ff3d44fe58af3968e2893853c8",
  "reviewers": [
    {
      "role": "ZERO_BASE",
      "reviewer_version": "research-benchmark-static-20260827-au",
      "decision": "PASS_WITH_NOTES",
      "score": 92,
      "warnings": [
        "Explains construction, hashing, injection, SSR/RSC or cache boundaries, and application checks."
      ],
      "execution": {
        "review_mode": "STATIC_REVIEW",
        "code_mode": "NOT_APPLICABLE"
      }
    },
    {
      "role": "ENGINEER",
      "reviewer_version": "research-benchmark-static-20260827-au",
      "decision": "PASS_WITH_NOTES",
      "score": 93,
      "warnings": [
        "Pinned revision, package identity, and core source files were inspected; upstream tests were not run."
      ],
      "execution": {
        "review_mode": "STATIC_REVIEW",
        "code_mode": "NOT_APPLICABLE"
      }
    },
    {
      "role": "ACADEMIC",
      "reviewer_version": "research-benchmark-static-20260827-au",
      "decision": "PASS_WITH_NOTES",
      "score": 93,
      "warnings": [
        "Evidence remains STATIC_REVIEW / UNVERIFIED; provenance conflicts or later tags are disclosed."
      ],
      "execution": {
        "review_mode": "STATIC_REVIEW",
        "code_mode": "NOT_APPLICABLE"
      }
    }
  ],
  "waivers": [],
  "created_at": "2026-08-27T07:40:00.000Z"
}
