{
  "schema_version": "study-review-receipt-v1",
  "generation": 1,
  "predecessor_digest_sha256": null,
  "note": {
    "area": "projects",
    "slug": "kleur",
    "digest_sha256": "62f02ba1d8521a2f3ad983071b583c9ea49b30387e8e22eb1a6ce1d9bb7bbf56"
  },
  "source_revision": "fa3454483899ddab550d08c18c028e6db1aab0e5",
  "research_input_sha256": "9063deafb258809c8a672660e4deabc628e16d1b5f9cf520c84f473c3a611879",
  "reviewers": [
    {
      "role": "ZERO_BASE",
      "reviewer_version": "research-benchmark-static-20260827-ez",
      "decision": "PASS_WITH_NOTES",
      "score": 91,
      "warnings": [
        "Separates chainable default export, kleur/colors functions, and FORCE_COLOR vs TTY detection."
      ],
      "execution": {
        "review_mode": "STATIC_REVIEW",
        "code_mode": "NOT_APPLICABLE"
      }
    },
    {
      "role": "ENGINEER",
      "reviewer_version": "research-benchmark-static-20260827-ez",
      "decision": "PASS_WITH_NOTES",
      "score": 93,
      "warnings": [
        "Inspected index.mjs, colors.mjs, build transform, and tests; uvu and env.sh were not run."
      ],
      "execution": {
        "review_mode": "STATIC_REVIEW",
        "code_mode": "NOT_APPLICABLE"
      }
    },
    {
      "role": "ACADEMIC",
      "reviewer_version": "research-benchmark-static-20260827-ez",
      "decision": "PASS_WITH_NOTES",
      "score": 90,
      "warnings": [
        "Claims bounded to kleur 4.1.5; README Node v10 load-time and ops/sec remain unmeasured."
      ],
      "execution": {
        "review_mode": "STATIC_REVIEW",
        "code_mode": "NOT_APPLICABLE"
      }
    }
  ],
  "waivers": [],
  "created_at": "2026-08-27T09:58:00.000Z"
}
