{
  "schema_version": "study-review-receipt-v1",
  "generation": 1,
  "predecessor_digest_sha256": null,
  "note": {
    "area": "projects",
    "slug": "log-update",
    "digest_sha256": "f8219b4d283c1e33249c6510d0e4f221a1f57009333833776305f10688679ef6"
  },
  "source_revision": "4f7a1460893a7557aee8f7202956218c3e770a5a",
  "research_input_sha256": "d062862366f3f5919d656cad3326c197f27c5e5c2822a019c22790f064771a64",
  "reviewers": [
    {
      "role": "ZERO_BASE",
      "reviewer_version": "research-benchmark-static-20260827-em",
      "decision": "PASS_WITH_NOTES",
      "score": 92,
      "warnings": [
        "Explains wrap/clip, prefix-suffix patch, persist vs done, and TTY synchronized output."
      ],
      "execution": {
        "review_mode": "STATIC_REVIEW",
        "code_mode": "NOT_APPLICABLE"
      }
    },
    {
      "role": "ENGINEER",
      "reviewer_version": "research-benchmark-static-20260827-em",
      "decision": "PASS_WITH_NOTES",
      "score": 93,
      "warnings": [
        "Inspected index.js createLogUpdate/diffFrames/buildPatch; xo/test/tsd were not executed."
      ],
      "execution": {
        "review_mode": "STATIC_REVIEW",
        "code_mode": "NOT_APPLICABLE"
      }
    },
    {
      "role": "ACADEMIC",
      "reviewer_version": "research-benchmark-static-20260827-em",
      "decision": "PASS_WITH_NOTES",
      "score": 91,
      "warnings": [
        "Binds annotated v8.0.0 peel matching npm gitHead; no unpublished follow-up SHA guessed."
      ],
      "execution": {
        "review_mode": "STATIC_REVIEW",
        "code_mode": "NOT_APPLICABLE"
      }
    }
  ],
  "waivers": [],
  "created_at": "2026-08-27T10:00:00.000Z"
}
