{
  "schema_version": "study-review-receipt-v1",
  "generation": 1,
  "predecessor_digest_sha256": null,
  "note": {
    "area": "projects",
    "slug": "aframe",
    "digest_sha256": "d7df5d98958a0fad71b3e0abc7b84b51c4c4e70c28203f02c1f68434e44413df"
  },
  "source_revision": "77f0513107e00e4738628a2ca8e8f19a38474857",
  "research_input_sha256": "afae7a27506fc1805fef7c3e62f88f1d8ec3dcb946214177c5a255665aca2bd4",
  "reviewers": [
    {
      "role": "ZERO_BASE",
      "reviewer_version": "research-benchmark-static-20260827-fd",
      "decision": "PASS_WITH_NOTES",
      "score": 91,
      "warnings": [
        "Separates HTML primitives, ECS registration timing, WebXR session entry, and unverified extras/animation-mixer."
      ],
      "execution": {
        "review_mode": "STATIC_REVIEW",
        "code_mode": "NOT_APPLICABLE"
      }
    },
    {
      "role": "ENGINEER",
      "reviewer_version": "research-benchmark-static-20260827-fd",
      "decision": "PASS_WITH_NOTES",
      "score": 93,
      "warnings": [
        "Inspected scene/entity/component, cursor/raycaster, gltf-model system; WebXR, Karma, and model load were not run."
      ],
      "execution": {
        "review_mode": "STATIC_REVIEW",
        "code_mode": "NOT_APPLICABLE"
      }
    },
    {
      "role": "ACADEMIC",
      "reviewer_version": "research-benchmark-static-20260827-fd",
      "decision": "PASS_WITH_NOTES",
      "score": 90,
      "warnings": [
        "Claims bounded to aframe 1.8.0 / super-three 0.184.0; stars, fps, and aframe-extras are out of scope."
      ],
      "execution": {
        "review_mode": "STATIC_REVIEW",
        "code_mode": "NOT_APPLICABLE"
      }
    }
  ],
  "waivers": [],
  "created_at": "2026-08-27T10:20:00.000Z"
}
