{
  "schema_version": "study-review-receipt-v1",
  "generation": 1,
  "predecessor_digest_sha256": null,
  "note": {
    "area": "papers",
    "slug": "injecagent",
    "digest_sha256": "f981a1ce67bc8b5ff126546a774b023f7c84d6a960d48a557fd1e5190992af00"
  },
  "source_revision": "arXiv:2403.02691v3",
  "research_input_sha256": "fc6411ed70548a353d43c75c4b5c01400b5718dbbaf3ecbd77634650e80e6c2d",
  "reviewers": [
    {
      "role": "ZERO_BASE",
      "reviewer_version": "study-static-review-20260715-agent-security-round",
      "decision": "PASS_WITH_NOTES",
      "score": 86,
      "warnings": [
        "Explains indirect prompt injection with a tool-agent scenario; InjecAgent was not executed."
      ],
      "execution": {
        "review_mode": "STATIC_REVIEW",
        "code_mode": "MANUAL_SIMULATION"
      }
    },
    {
      "role": "ENGINEER",
      "reviewer_version": "study-static-review-20260715-agent-security-round",
      "decision": "PASS_WITH_NOTES",
      "score": 84,
      "warnings": [
        "Tool boundary interpretation is static; no sandboxed attack replay or defense benchmark was performed."
      ],
      "execution": {
        "review_mode": "STATIC_REVIEW",
        "code_mode": "NOT_APPLICABLE"
      }
    },
    {
      "role": "ACADEMIC",
      "reviewer_version": "study-static-review-20260715-agent-security-round",
      "decision": "PASS_WITH_NOTES",
      "score": 84,
      "warnings": [
        "Citation identity was checked through arXiv metadata; benchmark results are not independently reproduced."
      ],
      "execution": {
        "review_mode": "STATIC_REVIEW",
        "code_mode": "NOT_APPLICABLE"
      }
    }
  ],
  "waivers": [],
  "created_at": "2026-07-15T04:12:00.000Z"
}
