{
  "schema_version": "study-review-receipt-v1",
  "generation": 1,
  "predecessor_digest_sha256": null,
  "note": {
    "area": "projects",
    "slug": "slash",
    "digest_sha256": "ab7752810216f037674aa89ff84f52a2ac1955aea825022dc504426d07ed1d72"
  },
  "source_revision": "98b618f5a3bfcb5dd374b204868818845b87bb2f",
  "research_input_sha256": "65a981417f3ed2cabd9ca97f2167dfa8f71d6744121c5e98396e4fafa486696d",
  "reviewers": [
    {
      "role": "ZERO_BASE",
      "reviewer_version": "research-benchmark-static-20260827-fp",
      "decision": "PASS_WITH_NOTES",
      "score": 92,
      "warnings": [
        "Separates replace-only slash from collapse/strip and the extended-length passthrough."
      ],
      "execution": {
        "review_mode": "STATIC_REVIEW",
        "code_mode": "NOT_APPLICABLE"
      }
    },
    {
      "role": "ENGINEER",
      "reviewer_version": "research-benchmark-static-20260827-fp",
      "decision": "PASS_WITH_NOTES",
      "score": 92,
      "warnings": [
        "index.js, test.js and index.d.ts inspected; xo/ava/tsd were not run."
      ],
      "execution": {
        "review_mode": "STATIC_REVIEW",
        "code_mode": "NOT_APPLICABLE"
      }
    },
    {
      "role": "ACADEMIC",
      "reviewer_version": "research-benchmark-static-20260827-fp",
      "decision": "PASS_WITH_NOTES",
      "score": 92,
      "warnings": [
        "Annotated tag v5.1.0 and npm gitHead agree; Windows runtime unmeasured."
      ],
      "execution": {
        "review_mode": "STATIC_REVIEW",
        "code_mode": "NOT_APPLICABLE"
      }
    }
  ],
  "waivers": [],
  "created_at": "2026-08-27T10:20:00.000Z"
}
