{
  "schema_version": "study-review-receipt-v1",
  "generation": 1,
  "predecessor_digest_sha256": null,
  "note": {
    "area": "projects",
    "slug": "pkgroll",
    "digest_sha256": "9a5c8e7c41070c05da69939f15895c8321dbb8516f2d14e51422e636bd8095dd"
  },
  "source_revision": "959847d0328d4683a3f259b7e1b4a494c98be120",
  "research_input_sha256": "f805f2baaff644c870ed65ab69917a9510296b09e9d69879bec7eeab29166f0b",
  "reviewers": [
    {
      "role": "ZERO_BASE",
      "reviewer_version": "research-benchmark-static-20260827-hb",
      "decision": "PASS_WITH_NOTES",
      "score": 92,
      "warnings": [
        "Separates dist-to-src mapping, current-Node default target, per-format Rollup graphs, and unpublished 0.0.0-semantic-release."
      ],
      "execution": {
        "review_mode": "STATIC_REVIEW",
        "code_mode": "NOT_APPLICABLE"
      }
    },
    {
      "role": "ENGINEER",
      "reviewer_version": "research-benchmark-static-20260827-hb",
      "decision": "PASS_WITH_NOTES",
      "score": 93,
      "warnings": [
        "Inspected cli flags, getPkgEntryPoints, publishConfig, externalize-dependencies, and dts composite=false; tests and packaging were not run."
      ],
      "execution": {
        "review_mode": "STATIC_REVIEW",
        "code_mode": "NOT_APPLICABLE"
      }
    },
    {
      "role": "ACADEMIC",
      "reviewer_version": "research-benchmark-static-20260827-hb",
      "decision": "PASS_WITH_NOTES",
      "score": 92,
      "warnings": [
        "Claims bounded to v2.27.1 / 959847d0; performance and other bundlers stay unbound."
      ],
      "execution": {
        "review_mode": "STATIC_REVIEW",
        "code_mode": "NOT_APPLICABLE"
      }
    }
  ],
  "waivers": [],
  "created_at": "2026-08-27T10:45:00.000Z"
}
