{
  "schema_version": "study-review-receipt-v1",
  "generation": 1,
  "predecessor_digest_sha256": null,
  "note": {
    "area": "projects",
    "slug": "keyv",
    "digest_sha256": "ea24acdf5f5786d8a01884c34effc4209d6c8fc78a5d008a6f83895728f7b1ac"
  },
  "source_revision": "e3f8f0099ea36bcd0b1ffcb62e7577c2c805281f",
  "research_input_sha256": "cce4937612635027c06d5687c45475adb355c6e08c4b15a6a1d85ef569d91f87",
  "reviewers": [
    {
      "role": "ZERO_BASE",
      "reviewer_version": "research-benchmark-static-20260827-bz",
      "decision": "PASS_WITH_NOTES",
      "score": 92,
      "warnings": [
        "Explains adapter vs Map, namespace prefix, millisecond TTL, and lazy expiry with application checks."
      ],
      "execution": {
        "review_mode": "STATIC_REVIEW",
        "code_mode": "NOT_APPLICABLE"
      }
    },
    {
      "role": "ENGINEER",
      "reviewer_version": "research-benchmark-static-20260827-bz",
      "decision": "PASS_WITH_NOTES",
      "score": 93,
      "warnings": [
        "Keyv constructor, serialize, get/set/has, hooks, and generic-store sources were inspected; upstream tests were not run."
      ],
      "execution": {
        "review_mode": "STATIC_REVIEW",
        "code_mode": "NOT_APPLICABLE"
      }
    },
    {
      "role": "ACADEMIC",
      "reviewer_version": "research-benchmark-static-20260827-bz",
      "decision": "PASS_WITH_NOTES",
      "score": 91,
      "warnings": [
        "Pinned to reachable 5.6.0 / tag 2026-01-20; npm gitHead missing; 6.x RC not bound."
      ],
      "execution": {
        "review_mode": "STATIC_REVIEW",
        "code_mode": "NOT_APPLICABLE"
      }
    }
  ],
  "waivers": [],
  "created_at": "2026-08-27T07:50:00.000Z"
}
